primary_id,sub_id,Name,Description
5.6,RB-16,Logging and Monitoring - Availability of the Monitoring Software,"The availability of the logging and monitoring software shall be monitored independently. In case the logging and monitoring software fails, the responsible employees shall be informed immediately."
5.6,RB-17,"Handling of Vulnerabilities, Malfunctions and Errors - Concept","Policies and instructions with technical and organisational safeguards shall be documented, communicated and provided according to SA-01 in order to ensure the prompt identification and addressing of vulnerabilities over all levels of the cloud service, for which they are responsible. The safeguards shall include among other things: 
 - Regular identification and analysis of vulnerabilities 
 - Regular follow-up of safeguards in order to address identified safeguards (e. g. installation of security updates according to internal target specifications)"
5.6,RB-18,"Handling of Vulnerabilities, Malfunctions and Errors - Penetration Tests","The cloud provider shall have penetration tests performed by qualified internal personnel or external service providers at least once a year. The penetration tests shall be carried out according to documented test methods and include the infrastructure components defined to be critical to the secure operation of the cloud service, which were identified as such as part of a risk analysis. Type, scope, time/period of time and results shall be documented comprehensively for an independent third party. Determinations from the penetration tests are assessed and, in case of medium or high criticality regarding the confidentiality, integrity or availability of the cloud service, followed up and remedied. The assessment of the criticality and the mitigating safeguards for the individual determinations shall be documented."
5.6,RB-19,"Handling of Vulnerabilities, Malfunctions and Errors - Integration with Change and Incident Management","Policies and instructions with technical and organisational safeguards for the handling of critical vulnerabilities shall be documented, communicated and provided according to SA-01. The safeguards shall be coordinated with the activities of the change management and the incident management."
5.6,RB-20,"Handling of Vulnerabilities, Malfunctions and Errors - Involvement of the Cloud Customer","The cloud customer shall be informed by the cloud provider of the status of the incidents affecting them in a regular and an appropriate form that corresponds to the contractual agreements or is involved into corresponding remedial actions. As soon as an incident was remedied from the cloud providers point of view, the cloud customer is informed of the safeguards taken. This information shall be sufficiently detailed so that the cloud customer can use it in their security management."
5.6,RB-21,"Handling of Vulnerabilities, Malfunctions and Errors - Check of Open Vulnerabilities","The IT systems which the cloud provider uses for the development and rendering of the cloud service shall be checked automatically for known vulnerabilities at least once a month. In the event of deviations from the expected configurations (for example, the expected patch level), the reasons for this shall be analysed in a timely manner and the deviations remedied or documented according to the exception process (see SA-03)."
5.6,RB-22,"Handling of Vulnerabilities, Malfunctions and Errors - System Hardening",System components which are used for the rendering of the cloud service shall be hardened according to generally established and accepted industry standards. The hardening instructions used shall be documented as well as the implementation status.
5.6,RB-23,Segregation of Stored and Processed Data of the Cloud Customers in Jointly used Resources,"Data shall be separated securely and strictly on jointly used virtual and physical resources (storage network, memory) according to a documented concept in order to guarantee the confidentiality and integrity of the stored and processed data."
5.7,IDM-01,Policy for System and Data Access Authorisations,"A role and rights concept based on the business and security requirements of the cloud provider as well as a policy for the management of system and data access authorisations shall be documented, communicated and provided according to SA-01 and address the following areas: 
 - Granting and change (provisioning) of data access authorisations on the basis of the least-privilege principle and as is necessary for performing the required tasks (need-to-know principle) 
 - Separation of functions between operative and controlling functions (also referred to as separation of duties) 
 - Separation of functions in the administration of roles, approval and granting of data access authorisations 
 - Regular review of granted authorisations 
 - Withdrawal of authorisations (de-provisioning) in case of changes to the employment relationship 
 - Requirements for the approval and documentation of the management of system and data access authorisations"
5.7,IDM-02,User Registration,System access authorisations for users under the responsibility of the cloud provider (internal and external employees) shall be granted in a formal procedure. Organisational and/or technical safeguards shall make sure that unique user IDs which clearly identify each user are granted.
5.7,IDM-03,Granting and Change (Provisioning) of Data Access Authorisations,"Granting and change of data access authorisations for users under the responsibility of the cloud provider shall comply with the policy for the management of system and data access authorisations. Organisational and/or technical safeguards shall make sure that the granted access authorisations meet the following requirements: 
 - Data access authorisations comply with the least-Privilege principle. 
 - When granting data access authorisations, only access authorisations necessary to perform the corresponding tasks should be granted (need to-know principle). 
 - Formal approval is given by an authorised person, before the data access authorisations are set up (i. e. before the user can access data of the cloud customers or components of the shared IT infrastructure). 
 - Technically assigned data access authorisations do not exceed the formal approval."
5.7,IDM-04,Withdrawal of Authorisations (De-provisioning) in Case of Changes to the Employment Relationship,"Data access authorisations of users under the cloud providers responsibility (internal and external employees) shall be withdrawn in the case of changes to the employment relationship (dismissal, transfer, longer period of absence/sabbatical/parental leave) promptly, but 30 days after its coming into force at the latest and/or suspended temporarily. Any access shall be deactivated completely as soon as the employment relationship has expired."
5.7,IDM-05,Regular Review of Data Access Authorisations,"Data access authorisations of users under the cloud providers responsibility (internal and external employees) shall be reviewed at least once a year in order to adjust them promptly to changes to the employment relationship (dismissal, transfer, longer period of absence/sabbatical/ parental leave). The review shall be performed by persons authorised to do so from corresponding part of the cloud provider, who are able to review the appropriateness of the granted authorisations due to their knowledge of the responsibilities. The review as well as the adjustments to the authorisations shall be documented comprehensibly."
5.7,IDM-06,Administrator Authorisations,"Granting and change of data access authorisations for internal and external users with administrative or extensive authorisations under the responsibility of the cloud provider shall comply with the policy or the management of system and data access authorisations (see IDM-01) or a separate policy. The authorisations shall be granted in a personalised manner and as is necessary for performing the corresponding tasks (need-to know principle). Organisational and/or technical safeguards shall make sure that granting these authorisations does not result in undesired, critical combinations which violate the principle of the separation of duties (e. g. assigning authorisations for the administration of both the database and the operating system). If this is not possible in certain selected cases, appropriate, compensating controls shall be established in order to identify any misuse of these authorisations (e. g. logging and monitoring by an SIEM (security information and event management) solution)."
5.7,IDM-07,Non-disclosure of Authentication Information,"Secret authentication credentials (e. g. passwords, certificates, security token) shall be assigned to internal and external users of the cloud provider or cloud customer, provided that this is subject to organisational or technical procedures of the cloud provider, in a proper organised procedure which ensures the confidentiality of the information. If it is assigned initially, it shall be valid only temporarily, but not longer than 14 days. Moreover, users shall be forced to change it when using it for the first time. Access of the cloud provider to the authentication information of the cloud customer shall be strictly regulated, communicated with the cloud customer and only takes place if it is necessary to perform the corresponding tasks (need-to-know principle). Access is documented and reported to the cloud customer."
5.7,IDM-08,Secure Login Methods,"The confidentiality of the login information of internal and external users under the cloud providers responsibility shall be protected by the following safeguards: 
 - Identity check by trusted procedures 
 - Use of recognised industry standards for the authentication and authorisation (e. g. multifactor authentication, no use of jointly used authentication information, automatic expiry) 
 - Multi-factor authentication for administrators of the cloud provider (e. g. using a smart card or biometric characteristics) is absolutely necessary"
5.7,IDM-09,Handling of Emergency Users,"The use of emergency users (for activities which cannot be carried out with personalised, administrative users, see IDM-06) shall be documented, to be justified and requires the approval by an authorised person, which takes the principle of the separation of functions into account. The emergency user shall be only activated as long as it is necessary to perform the corresponding tasks."
5.7,IDM-10,System-side Access Control,Access to information and application functions shall be limited by technical safeguards with which the role and rights concept is implemented.
5.7,IDM-11,Password Requirements and Validation Parameters,"Security parameters on the network, operating system (host and guest), database and application level (where relevant to the cloud service) shall be configured appropriately to avoid unauthorised access. If no two-factor authentication or use of one-time passwords is possible, the use of secure passwords on all levels and devices (including mobile devices) under the cloud providers responsibility shall be forced technically or must be ensured organisationally in a password policy. The targets must at least meet the following requirements: 
 - Minimum password length of 8 characters 
 - At least two of the following character types must be included: Capital letters, minor letters, special characters and numbers 
 - Maximum validity of 90 days, minimum validity of 1 day 
 - Password history of 6 
 - Transmission and storage of the passwords in an encrypted procedure that conforms to the state of the art."
5.7,IDM-12,Restriction and Control of Administrative Software,"The use of service programs and management consoles (e. g. for the management of the hypervisor or virtual machines), which allow extensive access to the data of the cloud customers, shall be restricted to authorised persons. Granting and changes to corresponding data access authorisations shall comply with the policy for the management of system and data access authorisations. Access shall be controlled by means of strong authentication techniques, including multi-factor authentication (see KOS-06)."
5.7,IDM-13,Control of Access to Source Code,"Access to the source code and supplementary information that is relevant to the development of the cloud service (e. g. architecture documentation, test plans) shall be granted restrictively and monitored in order to prevent unauthorised functions from being introduced and unintended changes from being made."
5.8,KRY-01,Policy for the Use of Encryption Procedures and Key Management,"Policies and instructions with technical and organisational safeguards for encryption procedures and key management shall be documented, communicated and provided according to SA-01, in which the following aspects shall be described: 
 - Using strong encryption procedures (e. g. AES) and the use of secure network protocols that correspond to the state of the art (e. g. TLS, IPsec, SSH) 
 - Risk-based regulations for the use of encryption which are compared to schemes for the classification of information and take the communication channel, type, strength and quality of the encryption into account 
 - Requirements for the secure generation, storage, archiving, retrieval, distribution, withdrawal and deletion of the keys 
 - Taking the relevant legal and regulatory obligations and requirements into consideration"
5.8,KRY-02,Encryption of Data for Transmission (Transport Encryption),Procedures and technical safeguards for strong encryption and authentication for the transmission of data of the cloud customers (e. g. electronic messages transported via public networks) shall be established.
5.8,KRY-03,Encryption of Sensitive Data for Storage,Procedures and technical safeguards for the encryption of sensitive data of the cloud customers for the storage shall be established. Exceptions apply to data that cannot be encrypted for the rendering of the cloud service for functional reasons. The private keys used for encryption shall be known only to the customer according to applicable legal and regulatory obligations and requirements. Exceptions (e. g. use of a master key by the cloud provider) shall be based on a controlled procedure and must be agreed upon jointly with the cloud customer.
5.8,KRY-04,Secure Key Management,"Procedures and technical safeguards for secure key management include at least the following aspects: 
 - Generation of keys for different cryptographic systems and applications 
 - Issuing and obtaining public-key certificates 
 - Provisioning and activation of the keys for customers and third parties involved 
 - Secure storage of own keys (not those of the cloud customers or other third parties) including the description as to how authorised users are granted access 
 - Changing or updating cryptographic keys including policies defining under which conditions and in which manner the changes and/or updates are to be realised 
 - Handling of compromised keys 
 - Withdrawal and deletion of keys, for example in the case of compromising or staff changes 
 - Storage of the keys of the cloud users not at the cloud provider (i. e. at the cloud user or a trusted third party)"
5.9,KOS-01,Technical Safeguards,"Based on the results of a risk analysis carried out according to OIS-06, the cloud provider shall implement technical safeguards which are suitable to promptly detect and respond to network-based attacks on the basis of irregular incoming or outgoing traffic patterns (e. g. by MAC spoofing and ARP poisoning attacks) and/or Distributed Denial- of-Service (DDoS) attacks."
5.9,KOS-02,Monitoring of Connections,"Physical and virtualised network environments shall be designed and configured in such a way that the connections between trusted and untrusted networks must be restricted and monitored. At defined intervals, it shall be reviewed whether the use of all services, logs and ports serve a real commercial purpose. In addition, the review shall also include the justifications for compensating controls for the use of logs which are considered to be insecure."
5.9,KOS-03,Cross-network Access,Each network perimeter shall be controlled by security gateways. The system access authorisation for cross- network access shall be based on a security assessment on the basis of the customer requirements.
5.9,KOS-04,Networks for Administration,"There are separate networks for the administrative management of the infrastructure and for the operation of management consoles, which shall be separated logically or physically by the network of the cloud customers and are protected against unauthorised access by means of multi-factor authentication (see IDM-08). Networks which are used for the purposes of the migration or the generation of virtual machines must also be separated physically or logically by other networks."
5.9,KOS-05,Segregation of Data Traffic in Jointly used Network Environments,The data traffic in jointly used network environments shall be segregated according to documented concept for the logical segmentation between the cloud customers on the network level in order to guarantee the confidentiality and integrity of the data transmitted.
5.9,KOS-06,Documentation of the Network Topology,"The architecture of the network shall be documented comprehensibly and currently (e. g. in the form of diagrams) in order to avoid errors in the management during live operation and ensure timely restoration according to the contractual duties in the event of damage. Different environments (e. g. administration network and shared network segments) and data flows become apparent from the documentation. Furthermore, the geographical locations, in which the data is stored, shall be specified."
5.9,KOS-07,Policies for Data Transmission,"Policies and instructions with technical and organisational safeguards in order to protect the transmission of data against unauthorised interception, manipulation, copying, modification, redirection or destruction (e. g. use of encryption) shall be documented, communicated and provided according to SA-01. The policy and instructions shall establish a reference to the classification of information (see AM-05)."
5.9,KOS-08,Confidentiality Agreement,"The non-disclosure or confidentiality agreements to be concluded with internal employees, external service providers and suppliers of the cloud provider shall be based on the requirements of the cloud provider in order to protect confidential data and business details. The requirements must be identified, documented and reviewed at regular intervals (at least once a year). If the review shows that the requirements have to be adjusted, new non-disclosure or confidentiality agreements shall be concluded with the internal employees, the external service providers and the suppliers of the cloud provider. The non-disclosure or confidentiality agreements must be signed by internal employees, external service providers or suppliers of the cloud provider prior to the start of the contract relationship and/or before access to data of the cloud users is granted."
5.1,PI-01,Use of Public APIs and Industry Standards,"In order to guarantee the interoperability of cloud services, data regarding documented input and output interfaces and in recognised industry standards (e. g. the Open Virtualization Format for virtual appliances) shall be available in order to support the communication between different components and the migration of applications."
5.1,PI-02,Export of Data,"At the end of the contract, the cloud customer can request the data to which they are entitled according to the contractual framework conditions, from the cloud provider and shall receive them in processable electronic standard formats such as CSV or XML."
5.1,PI-03,Policy for the Portability and Interoperability,"If no individual agreements between the cloud provider and cloud customer regulate the interoperability and portability of the data, policies and instructions with technical and organisational safeguards shall be documented, communicated and provided according to SA-01 in order to ensure the respective requirements and duties of the cloud customer."
5.1,PI-04,Secure Data Import and Export,"The cloud provider shall use secure network protocols for the import and export of information as well as for the management of the service in order to ensure the integrity, confidentiality and availability of the transported data."
5.1,PI-05,Secure Deletion of Data,"Both when changing the storage media for maintenance purposes and upon request of the cloud customer or the termination of the contract relationship, the content data of the cloud customer, including the data backups and the meta data (as soon as they are no longer required for the proper documentation of the accounting and billing), shall be deleted completely. The methods used for this (e. g. by overwriting data several times, deletion of the key) prevent the data from being restored via forensic methods."
5.11,BEI-01,Policies for the Development/Procurement of Information Systems,"Policies and instructions with technical and organisational safeguards for the proper development and/or procurement of information systems for the development or operation of the cloud service, including middleware, databases, operating systems and network components shall be documented, communicated and provided according to SA-01. The policies and instructions shall describe at least the following aspects: 
 - Security in software development methods in compliance with security standards established in the industry (e. g. OWASP for web applications) 
 - Security of the development environment (e. g. separate development/test/production environments) 
 - Programming policies for each programming language used (e. g. regarding buffer overflows, hiding internal object references towards users) 
 - Security in version control"
5.11,BEI-02,Outsourcing of the Development,"If the development of the cloud service (or parts thereof) is outsourced regarding the design, development, test and/or provision of source code of the cloud service, a high level of security shall be required. Therefore, at least the following aspects must be agreed upon contractually between the cloud provider and external service providers: 
 - Requirements for a secure software development process (especially design, development and testing) 
 - Provision of evidence demonstrating that adequate testing was carried out by the external service provider 
 - Acceptance test of the quality of the services rendered according to the functional and nonfunctional requirements agreed upon 
 - The right to subject the development process and controls to testing, also on a random basis"
5.11,BEI-03,Policies for Changes to Information Systems,"Policies and instructions with technical and organisational safeguards for the proper management of changes to information systems for the development or operation of the cloud service, including middleware, databases, operating systems and network components shall be documented, communicated and provided according to SA-01. At least the following aspects are to be taken into account in this respect: 
 - Criteria for the classification and prioritisation of changes and related requirements for the type and scope of tests to be carried out and permits to be obtained 
 - Requirements for the notification of affected cloud customers according to the contractual agreements 
 - Requirements for the documentation of tests as well as for the application and permit of changes 
 - Requirements for the documentation of changes to the system, operating and user documentation"
5.11,BEI-04,Risk Assessment of Changes,The principal of a change shall perform a risk assessment beforehand. All configuration objects which might be affected by the change shall be assessed with regard to potential impacts. The result of the risk assessment shall be documented appropriately and comprehensively.
5.11,BEI-05,Categorisation of Changes,"All changes shall be categorised on the basis of a risk assessment (e. g. as insignificant, significant or farreaching impacts) in order to obtain an appropriate authorisation prior to making the change available to the production environment."
5.11,BEI-06,Prioritisation of Changes,"All changes shall be prioritised on the basis of a risk assessment (e. g. as low, normal, high, emergency) in order to obtain an appropriate authorisation prior to making the change available to the production environment."
5.11,BEI-07,Testing Changes,"All changes to the cloud service shall be subject to tests (e. g. for integration, regression, security and user acceptance) during the development and before they are made available to the production environment. The tests shall be carried out by adequately qualified personnel of the cloud provider. According to the service level agreement (SLA), changes shall also be tested by the customers (tenants) suitable for this."
5.11,BEI-08,Rollback of Changes,Processes shall be defined in order to be able to roll back required changes as a result of errors or security concerns and restore affected systems or services into its previous state.
5.11,BEI-09,Review of Proper Testing and Approval,"Before a change is released to the production environment, it must be reviewed by an authorised body or a corresponding committee whether the planned tests have been completed successfully and the required approvals are granted."
