primary_id,sub_id,Name,Description
4,UP-01,System Description,"In the system description, the cloud provider shall provide comprehensible and transparent specifications regarding the cloud service, which allow an expert third party to assess the general suitability of the cloud service for the desired application. The system description describes the following aspects: 
 - Type and scope of the cloud services rendered according to the service level agreement which is typically based on a contract concluded with the cloud customers 
 - Principles, procedures and safeguards for rendering (development and/or operation) the cloud service, including the controls established 
 - Description of the infrastructure, network and system components used for the development and operation of the cloud service 
 - Handling of significant incidents and conditions which constitute exceptions to regular operations, such as the failure of critical IT systems 
 - Roles and responsibilities of the cloud provider and the cloud customer, including the duties to cooperate and corresponding controls at the cloud customer 
 - Functions assigned or outsourced to subcontractors"
4,UP-02,"Jurisdiction and Data Storage, Processing and Backup Locations","In service level agreements, the process documentation or comparable documentation, the cloud provider shall provide comprehensible and transparent specifications regarding its jurisdiction as well as with respect to data storage, processing and backup locations, which allow an expert third party to assess the general suitability of the cloud service for the customer application. This also holds true if data of the cloud customer is processed, stored and backed up by subcontractors of the cloud provider. Data of the cloud customer shall only be processed, stored and backed up outside the contractually agreed locations only with the prior express written consent of the cloud customer."
4,UP-03,Disclosure and Investigatory Powers,"In service level agreements, the process documentation or comparable documentation, the cloud provider shall provide comprehensible and transparent specifications regarding applicable disclosure and investigatory powers of government agencies which allow access to data of the cloud customer. The specifications must allow an expert third party to assess the general suitability of the cloud service for the customer application. If the cloud provider accesses third-party services, the provider has obtained these specifications from them."
4,UP-04,Certifications,"In service level agreements, the process documentation or comparable documentation, the cloud provider shall provide comprehensible and transparent specifications regarding available and valid certifications and certificates of independent third parties, which allow an expert third party to assess the general suitability of the cloud service for the customer application."
5.1,OIS-01,Information Security Management System (ISMS),"The top management shall initiate, control and monitor an information security management system (ISMS) which is based on ISO standards of the 2700x series. 
 - The instruments and methods used allow a comprehensible control of the following tasks and activities to permanently maintain and ensure information security: Planning, implementing the plan and/or carrying out the project 
 - Performance review and/or monitoring the achievement of objectives 
 - Eliminating discovered flaws, weaknesses and continuous improvement. 
 
 The ISMS also includes the IT processes for the development and operation of the cloud service."
5.1,OIS-02,Strategic Targets Regarding Information Security and Responsibility of the Top Management,"A security policy with security objectives and strategic parameters for achieving these objectives shall be documented. The security objectives are derived from the corporate objectives and business processes, relevant laws and regulations as well as the current and future expected threat environment with respect to information security. The strategic targets constitute essential framework conditions which in further policies and instructions are specified in more detail (see SA- 01). The security policy shall be adopted by the top management and communicated to all concerned internal and external parties of the cloud provider (e. g. cloud customers, subcontractors)."
5.1,OIS-03,Authorities and Responsibilities in the Framework of Information Security,"Responsibilities shared between the cloud provider and cloud customers, duties to cooperate as well as interfaces for the reporting of security incidents and malfunctions shall be defined, documented, assigned depending on the respective cloud model (infrastructure, platform or software as a service) and the contractual duties and communicated to all concerned internal and external parties (e. g. cloud customers, subcontractors of the cloud provider). On the part of the cloud provider, at least the following roles (or comparable equivalents) are described in the security policy or associated policies and corresponding responsibilities assigned: 
 - Head of IT (CIO) 
 - IT Security Officer (CISO) 
 - Representative for the handling of IT security incidents (e. g. Head of CERT) 
 
 Changes to the responsibilities and interfaces shall be communicated internally and externally in such a timely manner that all internal and external parties concerned (e. g. cloud customers) are able to respond to them appropriately with organisational and technical safeguards, before the change becomes effective."
5.1,OIS-04,Separation of Functions,"Organisational and technical controls shall be established in order to ensure the separation of roles and responsibilities (also referred to the separation of duties) which are incompatible with respect to the confidentiality, integrity and availability of information of the cloud customers. Controls for the separation of functions are established in the following areas in particular: 
 - Administration of roles, granting and assignment of access authorisations for users under the responsibility of the cloud provider 
 - Development and implementation of changes to the cloud service 
 - Maintenance of the physical and logical IT infrastructure relevant to the cloud service (networks, operating systems, databases) and the IT applications if they are in the cloud providers area of responsibility according to the contractual agreements with the cloud customers 
 
 Operative and controlling functions shall not be performed by one and the same person at the same time. If it is not possible to achieve a separation of duties for organisational or technical reasons, appropriate compensating controls are established in order to prevent or uncover improper activities."
5.1,OIS-05,Contact with Relevant Government Agencies and Interest Groups,Appropriate and relevant contacts of the cloud provider with government agencies and interest groups shall be established to be always informed about current threat scenarios and countermeasures.
5.1,OIS-06,Policy for the Organization of the Risk Management,"Policies and instructions for the general procedure applicable to the identification, analysis, assessment and handling of risks and IT risks in particular shall be documented, communicated and provided according to SA-01."
5.1,OIS-07,"Identification, Analysis, Assessment and Handling of Risks","The procedures for the identification, analysis, assessment and handling of risks, including the IT risks relevant to the cloud service shall be done at least once a year in order to take internal and external changes and influencing factors into account. The identified risks shall be comprehensively documented, assessed and provided with mitigating safeguards according to the safeguards of the risk management."
5.2,SA-01,"Documentation, Communication and Provision of Policies and Instructions","Policies and instructions for information security or related topics derived from the security policy shall be documented in a uniform structure. They shall be communicated and made available to all internal and external employees of the cloud provider properly and adequately. Policies shall be versioned and approved by top management of the cloud provider. The policies and instructions shall describe at least the following aspects: 
 - Goals 
 - Scopes of application 
 - Roles and responsibilities, including requirements for the qualification of the personnel and the establishment of substitution arrangements 
 - Coordination of different company departments 
 - Security architecture and safeguards for the protection of data, IT applications and IT infrastructures which are managed by the cloud provider or third parties 
 - Safeguards for the compliance with legal and regulatory requirements (compliance)"
5.2,SA-02,Review and Approval of Policies and Instructions,"The policies and instructions for information security shall be reviewed with respect to their appropriateness and effectiveness by specialists of the cloud provider who are familiar with the topic at least once a year. At least the following aspects shall be taken into account in the review: 
 - Organisational changes at the cloud provider 
 - Current and future expected threat environment regarding information security 
 - Legal and technical changes in the cloud providers environment 
 
 Revised policies and instructions shall be approved by committees or bodies of the cloud provider authorised to do so before they become valid."
5.2,SA-03,Deviations from Existing Policies and Instructions,Exceptions of policies and instructions for information security shall be approved by committees or bodies of the cloud provider authorised to do so in a documented form. The appropriateness of approved exceptions and the assessment of the risks resulting from this shall be reviewed by specialists of the cloud provider who are familiar with the topic against the backdrop of the current and future expected threat environment regarding information security at least once a year.
5.3,HR-01,Security Check of the Background Information,"The background of all internal and external employees of the cloud provider with access to data of the cloud customers or of the shared IT infrastructure shall be checked according to the local legislation and regulation by the cloud provider prior to the start of the employment relationship. To the extent permitted by law, the security check shall include the following areas: 
 - Verification of the person by means of the identity card 
 - Verification of the curriculum vitae 
 - Verification of academic titles and degrees 
 - Request of a police clearance certificate for sensitive posts in the company"
5.3,HR-02,Employment Agreements,"Employment agreements shall include the obligations of the cloud providers internal and external employees to comply with relevant laws, regulations and provisions regarding information security (see KOS-10). The security policy as well as the policies and instructions for information security derived from this shall be added to the employment agreement documents. Corresponding compliance shall be confirmed by the employee by a written statement before they can access the data of the cloud customers or the (shared) IT infrastructure."
5.3,HR-03,Security Training and Awareness-raising Programme,"A security training and awareness-raising programme tailored to specific target groups on the topic of information security shall be available and mandatory for all internal and external employees of the cloud provider. The programme shall be updated at regular intervals with respect to the applicable policies and instructions, the assigned roles and responsibilities as well as the known threats and must then be run through again. The programme shall include at least the following contents: 
 - Regular and documented instruction on the secure configuration and secure operation of the IT applications and IT infrastructure required for the cloud service, including mobile terminal devices 
 - Appropriate handling of data of the cloud customers 
 - Regular and documented instruction on known basic threats and 
 - Regular and documented training on the behaviour in case of security-relevant events. 
 
 External service providers and suppliers of the cloud provider, who contribute to the development or operation of the cloud service, shall be obliged by contract to make their employees and subcontractors aware of the specific security requirements of the cloud provider and train their employees generally in the subject of information security."
5.3,HR-04,Disciplinary Measures,A process for performing disciplinary measures shall be implemented and communicated to the employees in order to make the consequences of violations of the applicable policies and instructions as well as legal provisions and laws transparent.
5.3,HR-05,Termination of the Employment Relationship or Changes to the Responsibilities,"Internal as well as external employees shall be informed that the obligations to comply with relevant laws, regulations and provisions regarding information security remain valid even if the area of responsibility changes or the employment relationship is terminated."
5.4,AM-01,Asset Inventory,"The assets (e. g. PCs, peripheral devices, telephones, network components, servers, installation documentation, process instructions, IT applications, tools) used to render the cloud service shall be identified and inventoried. By means of appropriate processes and safeguards, it shall be ensured that this inventory remains complete, correct, up-to-date and consistent. A history of the changes to the entries in the inventory shall be kept in a comprehensible manner. If no effective automatic procedures are established for this, this shall be ensured by a manual review of the inventory data of the assets which takes place at least once a month."
5.4,AM-02,Assignment of Persons Responsible for Assets,All inventoried assets shall be assigned to a person responsible on the part of the cloud provider. The persons responsible of the cloud provider are responsible over the entire life cycle of the assets to ensure that they are inventoried completely and classified correctly.
5.4,AM-03,Instruction Manuals for Assets,"Policies and instructions with technical and organisational safeguards for the proper handling of assets shall be documented, communicated and provided according to SA-01 in the respectively current version."
5.4,AM-04,Handing in and Returning Assets,All internal and external employees of the cloud provider shall be obliged to return or irrevocably delete all assets which were handed over to them in relation to the cloud service and/or for which they are responsible as soon as the employment relationship has been terminated.
5.4,AM-05,Classification of Information,The cloud provider shall use a uniform classification of information and assets which are relevant to the development and rendering of the cloud service.
5.4,AM-06,Labelling of Information and Handling of Assets,Work instructions and processes for the implemented classification scheme of information and assets shall be in place in order to ensure the labeling of information as well as the corresponding handling of assets. This only refers to assets which store or process information.
5.4,AM-07,Management of Data Media,"Policies and instructions with technical and organisational safeguards for the secure handling of data media of any type shall be documented, communicated and provided according to SA-01. The targets establish a reference to the classification of information (see AM-05). They include the secure use, the secure transport as well as the irrevocable deletion and destruction of data media."
5.4,AM-08,Transfer and Removal of Assets,"Devices, hardware, software or data may only be transferred to external premises after it has been approved by authorised committees or bodies of the cloud provider. The transfer takes place securely according to the type of the assets to be transferred."
5.5,PS-01,Perimeter Protection,"The perimeter of premises or buildings which house sensitive or critical information, information systems or other network infrastructure shall be protected in a physically solid manner and by means of appropriate security safeguards that conform to the current state of the art."
5.5,PS-02,Physical Site Access Control,"Access to the premises or buildings which house sensitive or critical information, information systems or other network infrastructure shall be secured and monitored by means of physical site access controls in order to avoid unauthorised site access."
5.5,PS-03,Protection Against Threats from Outside and from the Environment,"Structural, technical and organisational safeguards shall be taken to protect premises or buildings which house sensitive or critical information, information systems or other network infrastructure against fire, water, earthquakes, explosions, civil disturbances and other forms of natural threats and threats caused by humans. At two geo-redundant sites, at least the following safeguards are carried out: 
 
 Structural safeguards: 
 - Setup of a separate fire zone for the computer centre 
 - Use of fire-resistant materials according to DIN 4102-1 or EN 13501 (period of fire resistance of at least 90 minutes) 
 
 Technical safeguards: 
 - Sensors to monitor temperature and humidity 
 - Connecting the building to a fire alarm system with notification of the local fire department 
 - Early fire detection and extinguishing systems 
 
 Organisational safeguards: 
 - Regular fire drills and fire safety inspections to check compliance with fire protection measures"
5.5,PS-04,Protection Against Interruptions Caused by Power Failures and Other Such Risks,"Precautions against the failure of supply services such as power, cooling or network connections shall be taken by means of suitable safeguards and redundancies in coordination with safeguards for operational reliability. Power and telecommunication supply lines which transport data or supply information systems must be protected against interception and damage."
5.5,PS-05,Maintenance of Infrastructure and Devices,"Policies and instructions with technical and organisational safeguards shall be documented, communicated and provided according to SA-01 which describe the maintenance (especially remote maintenance), deletion, updating and re-use of assets in information processing in outsourced premises or by external personnel."
5.6,RB-01,Capacity Management - Planning,The planning of capacities and resources (personnel and IT resources) shall follow an established procedure in order to avoid capacity bottlenecks. The procedures include forecasts of future capacity requirements in order to identify use trends and master system overload risks.
5.6,RB-02,Capacity Management - Monitoring,"Technical and organisational safeguards for the monitoring and provisioning and de-provisioning of cloud services shall be defined. Thus, the cloud provider ensures that resources are provided and/or services are rendered according to the contractual agreements and that compliance with the service level agreements is ensured."
5.6,RB-03,Capacity Management - Data Location,The cloud customer shall be able to determine the locations (city/country) of the data processing and storage including data backups.
5.6,RB-04,Capacity Management - Control of Resources,"In case of IaaS/PaaS, the cloud customer shall be able to control and monitor the distribution of the system resources assigned to them for administration/use (e. g. computing capacity or storage capacity) in order to prevent resources from being congested."
5.6,RB-05,Protection Against Malware,"The logical and physical IT systems which the cloud provider uses for the development and rendering of the cloud service as well as the network perimeters which are subject to the cloud providers area of responsibility shall be equipped with anti-virus protection and repair programs which allow for a signature- and behaviour-based detection and removal of malware. The programs shall be updated according to the contractual agreements concluded with the manufacturer(s), but at least once a day."
5.6,RB-06,Data Backup and Restoration - Concept,"Policies and instructions with technical and organisational safeguards in order to avoid losing data shall be documented, communicated and provided according to SA-01. They provide reliable procedures for the regular backup (backup as well as snapshots, where applicable) and restoration of data. The scope, frequency and duration of the retention comply with the contractual agreements concluded with the cloud customers as well as the cloud providers business requirements. Access to the data backed up shall be limited to authorised personnel. Restoration procedures include control mechanisms that ensure that restorations shall be carried out only after they have been approved by persons authorised to do so according to the contractual agreements with the cloud customers or the internal policies of the cloud provider."
5.6,RB-07,Data Backup and Restoration - Monitoring,"The process of backing up data shall be monitored by means of technical and organisational safeguards. Malfunctions shall be examined and eliminated promptly by qualified employees in order to ensure compliance with the contractual duties towards the cloud customers or the cloud providers business requirements with respect to the scope, frequency and duration of the retention."
5.6,RB-08,Data Backup and Restoration - Regular Tests,Backup media and restoration procedures shall be tested with dedicated test media by qualified employees at regular intervals. The tests shall be designed in such a way that the reliability of the backup media and the restoration time can be audited with sufficient certainty. The tests shall be carried out by qualified employees and the results documented comprehensively. Any occurring errors are eliminated in a timely manner.
5.6,RB-09,Data Backup and Restoration - Storage,"The data to be backed up shall be transmitted to a remote site (e. g. another data centre of the cloud provider) or transported to a remote site on backup media. If the backup of the data is transmitted to the remote site via a network, this shall be carried out in an encrypted form that conforms to the state of the art. The distance to the main site should be large enough to ensure that catastrophes there do not lead to a loss of data at the remote site and, at the same time, short enough to be able to fulfill the contractual duties regarding the restoration times. The safeguards taken to ensure the physical and environment-related security at the remote site corresponds to the level at the main site."
5.6,RB-10,Logging and Monitoring - Concept,"Policies and instructions with technical and organisational safeguards shall be documented, communicated and provided according to SA-01 in order to log events on all assets which are used for the development or operation of the cloud service and to store them in a central place. The logging includes defined events which may impair the security and availability of the cloud service, including logging the activation, stopping and pausing of different logs. In case of unexpected or unusual events, the logs shall be checked by authorised personnel due to special events in order to allow for a timely examination of malfunctions and security incidents as well as for the initiation of suitable safeguards."
5.6,RB-11,Logging and Monitoring - Meta Data,"Policies and instructions with technical and organisational safeguards for the secure handling of meta data (user data) shall be documented, communicated and provided according to SA-01. The meta data shall be collected and used only for accounting and billing purposes, for eliminating malfunctions and errors (incident management) as well as for processing security incidents (security incident management). The meta data shall not be used for commercial purposes. Meta data must be deleted immediately once it is no longer required to fulfill the legitimate purpose according to this requirement. The period of time during which meta data is retained shall be determined by the cloud provider. It is reasonably related to the purposes pursued with the collection of meta data."
5.6,RB-12,Logging and Monitoring - Critical Assets,"The cloud provider shall maintain a list of all assets critical in terms of logging and monitoring and reviews this list for their currency and correctness at regular intervals. For these critical assets, advanced logging and monitoring safeguards shall be defined."
5.6,RB-13,Logging and Monitoring - Storage of the Logs,The generated logs shall be stored on central logging servers on which they are protected against unauthorised access and changes. Logged data must be deleted immediately once they are no longer required to fulfill the purpose. Authentication shall take place between the logging servers and the logged assets in order to protect the integrity and authenticity of the transmitted and stored information. The transmission shall be encrypted that conforms to the state of the art or via a separate administration network (out-of-band management).
5.6,RB-14,Logging and Monitoring - Accountability,The generated logs shall allow for a clear identification of user access to the tenant level in order to support (forensic) analyses in the case of a security incident.
5.6,RB-15,Logging and Monitoring - Configuration,The access and management of the logging and monitoring functionalities shall be limited to selected and authorised employees of the cloud provider. Changes to the logging and monitoring shall be checked by independent and authorised employees and approved beforehand.
