primary_id,sub_id,Name,Description
9,9(c),Personnel Trained,"Devices that capture payment card data via direct physical interaction with the card protected against tampering and substitution as follows: 
Policies and procedures shall require that personnel are trained to be aware of suspicious behavior and to report tampering or substitution of devices.
 
 Note: This requirement applies to card-reading devices used in card-present transactions (that is, card swipe or dip) at the point of sale. This requirement is not intended to apply to manual key-entry components such as computer keyboards and POS keypads."
9,9.1(a),Inventory,"The list of devices shall include the following: 
 
 - Make, model of device 
 - Location of device (for example, the address of the site or facility where the device is located) 
 - Device serial number or other method of unique identification"
9,9.1(b),Accurate and Up-to-Date,The list of devices shall be accurate and up to date.
9,9.1(c),"Updated when Added, Relocated, or Decommissioned","The list of devices shall be updated when devices are added, relocated, decommissioned, etc."
9,9.2(a),Device Surfaces Inspected,"Device surfaces shall be periodically inspected to detect tampering (for example, addition of card skimmers to devices), or substitution (for example, by checking the serial number or other device characteristics to verify it has not been swapped with a fraudulent device). 
 
Note: Examples of signs that a device might have been tampered with or substituted include unexpected attachments or cables plugged into the device, missing or changed security labels, broken or differently colored casing, or changes to the serial number or other external markings."
9,9.2(b),Personnel Aware of Procedures for Inspections,Personnel shall be aware of procedures for inspecting devices.
9,9.3(a),Training Topics,"Personnel shall be trained to be aware of attempted tampering or replacement of devices, to include the following: 
Training materials for personnel at point-of-sale locations shall include the following:
 
 - Verify the identity of any third-party persons claiming to be repair or maintenance personnel, prior to granting them access to modify or troubleshoot devices. 
 - Do not install, replace, or return devices without verification. 
 - Be aware of suspicious behavior around devices (for example, attempts by unknown persons to unplug or open devices). 
 - Report suspicious behavior and indications of device tampering or substitution to appropriate personnel (for example, to a manager or security officer)."
9,9.3(b),Point-of-Sale Location Trainings on Detecting and Reporting Attempted Tampering,"Personnel shall be trained to be aware of attempted tampering or replacement of devices, to include the following: 
Personnel at point-of-sale locations shall receive training, and shall be aware of procedures to detect and report attempted tampering or replacement of devices."
10,2.2,Audit Administrative Privilege Use,All actions shall be taken by any individual with root or administrative privileges.
10,2.4,Audit Failed Access Attempts,Log and audit all invalid logical access attempts.
10,2.5,Audit Use of Authentication,"Use of and changes to identification and authentication mechanisms including but not limited to creation of new accounts and elevation of privileges and all changes, additions, or deletions to accounts with root or administrative privileges shall be logged/audited. "
10,3.1,Audit Trail - User Identification,"The following audit trail entries shall be recorded for all system components for each event: 
User identification"
10,3.2,Audit Trail - Type of event,"The following audit trail entries shall be recorded for all system components for each event: 
Type of event"
10,3.3,Audit Trail - Time of Event,"The following audit trail entries shall be recorded for all system components for each event: 
Date and time"
10,3.4,Audit Trail - Success or Failure,"The following audit trail entries shall be recorded for all system components for each event: 
Success or failure indication"
10,3.5,Audit Trail - Origin,"The following audit trail entries shall be recorded for all system components for each event: 
Origination of event"
10,3.6,Audit Trail - System Component,"The following audit trail entries shall be recorded for all system components for each event: 
Identity or name of affected data, system component, or resource"
10,6.1(a),Daily Log and Events Review,"Logs and security events for all system components shall be reviewed to identify anomalies or suspicious activity as follows: 
The following logs and security events shall be reviewed at least daily, either manually or via log tools:
 
 - All security events 
 - Logs of all system components that store, process, or transmit CHD and/or SAD 
 - Logs of all critical system components 
 - Logs of all servers and system components that perform security functions (for example, firewalls, intrusion-detection systems/intrusion-prevention systems (IDS/IPS), authentication servers, ecommerce redirection servers, etc.)"
10,6.2(b),Review Other Logs Periodically,"Logs and security events for all system components shall be reviewed to identify anomalies or suspicious activity as follows: 
Logs of all other system components shall be periodically reviewed, either manually or via log tools, based on the organizations policies and risk management strategy."
10,6.3(b),Follow Up To Log Review,"Logs and security events for all system components shall be reviewed to identify anomalies or suspicious activity as follows: 
Follow up to exceptions and anomalies shall be identified during the review process performed."
10,7(b),Audit Trails - Retention,Audit logs shall be retained for at least one year.
10,7(c),Audit Trails - Retention - Availability,At least the last three months logs shall be immediately available for analysis.
11,1(a),Wireless Access Points,"Processes shall be implemented for detection and identification of both authorized and unauthorized wireless access points on a quarterly basis.
 
 Note: Methods that may be used in the process include, but are not limited to, wireless network scans, physical/logical inspections of system components and infrastructure, network access control (NAC), or 
 wireless IDS/IPS. 
 
 Whichever methods are used, they must be sufficient to detect and identify any unauthorized devices."
11,1(b),Methodology to Detect and Identify,"The methodology shall detect and identify any unauthorized wireless access points, including at least the following: 
 
 - WLAN cards inserted into system components; 
 - Portable or mobile devices attached to system components to create a wireless access point (for example, by USB, etc.); and 
 - Wireless devices attached to a network port or network device."
11,1(c),Quarterly Scans,"If wireless scanning is utilized to identify authorized and unauthorized wireless access points, the scan shall be performed at least quarterly for all system components and facilities."
11,1(d),Automated Monitoring,"If automated monitoring is utilized (for example, wireless IDS/IPS, NAC, etc.), monitoring shall be configured to generate alerts to notify personnel."
11,1.1,Inventory of Wireless Access Points,An inventory of authorized wireless access points shall be maintained and a business justification documented for all authorized wireless access points. 
11,1.2(a),Incident Response Plan,The incident response plan shall be defined and require a response in the event that an unauthorized wireless access point is detected.
11,1.2(b),Action Take for Unauthorized Access Points,Action shall be taken when unauthorized wireless access points are found.
11,2.1(a),Quarterly Vulnerability Scans,"Internal and external network vulnerability scans shall be run at least quarterly and after any significant change in the network (such as new system component installations, changes in network topology, firewall rule modifications, product upgrades), as follows: Quarterly internal vulnerability scans shall be performed.
 
 Note: Multiple scan reports can be combined for the quarterly scan process to show that all systems were scanned and all applicable vulnerabilities have been addressed. Additional documentation may be required to verify non-remediated vulnerabilities are in the process of being addressed. 
 
 For initial PCI DSS compliance, it is not required that four quarters of passing scans be completed if the assessor verifies 1) the most recent scan result was a passing scan, 2) the entity has documented policies and procedures requiring quarterly scanning, and 3) vulnerabilities noted in the scan results have been corrected as shown in a re-scan(s). For subsequent years after the initial PCI DSS review, four quarters of passing scans must have occurred."
11,2.1(b),Scans Address All High Risk Vulnerabilities,"Internal and external network vulnerability scans shall run at least quarterly and after any significant change in the network (such as new system component installations, changes in network topology, firewall rule modifications, product upgrades), as follows: 
The quarterly internal scan process shall address all high risk vulnerabilities and include rescans to verify all high-risk vulnerabilities (as defined in PCI DSS Requirement 6.1) are resolved."
11,2.1(c),Scans Performed by a Qualified Internal Resource,"Internal and external network vulnerability scans shall run at least quarterly and after any significant change in the network (such as new system component installations, changes in network topology, firewall rule modifications, product upgrades), as follows: 
Quarterly internal scans shall be performed by a qualified internal resource(s) or qualified external third party, and if applicable, the organizational independence of the tester shall exist (not required to be a QSA or ASV)?"
11,2.2(a),External Vulnerability Scans,"Quarterly external vulnerability scans shall be performed. 
Note: Quarterly external vulnerability scans must be performed by an Approved Scanning Vendor (ASV), approved by the Payment Card Industry Security Standards Council (PCI SSC). 
 Refer to the ASV Program Guide published on the PCI SSC website for scan customer responsibilities, scan preparation, etc."
11,2.2(b),External Vulnerability Scans - Results,"External quarterly scan and rescan results shall satisfy the ASV Program Guide requirements for a passing scan (for example, no vulnerabilities rated 4.0 or higher by the CVSS, and no automatic failures)."
11,2.2(c),External Vulnerability Scans - Approved Vendor,Quarterly external vulnerability scans shall be performed by a PCI SSC Approved Scanning Vendor (ASV).
11,2.3(a),Vulnerability Scans After Significant Changes,"Internal and external scans, and rescans as needed, shall be performed after any significant change. 
 Note: Scans must be performed by qualified personnel"
11,2.3(b),Vulnerability Scans After Significant Changes - Rescan criteria,"The scan process shall include rescans until: 
 For external scans, no vulnerabilities exist that are scored 4.0 or higher by the CVSS; 
 For internal scans, a passing result is obtained or all high-risk vulnerabilities as defined in PCI DSS Requirement 6.1 are resolved."
11,2.3(c),Vulnerability Scans After Significant Changes - Approved Scanner,"Scans shall be performed by a qualified internal resource(s) or qualified external third party, and if applicable, organizational independence of the tester shall exist (not required to be a QSA or ASV)."
11,3.4(a),Segmentation Penetration Test - Procedures Defined,"If segmentation is used to isolate the CDE from other networks, penetration-testing procedures shall be defined to test all segmentation methods, to confirm they are operational and effective, and isolate all out-of-scope systems from systems in the CDE."
11,3.4(b),Segmentation Penetration Test - Segmentation Controls,"If segmentation is used to isolate the CDE from other networks, penetration testing to verify segmentation controls shall meet the following:
 
 - Performed at least annually and after any changes to segmentation controls/methods. 
 - Covers all segmentation controls/methods in use. 
 - Verifies that segmentation methods are operational and effective, and isolate all out-of-scope systems from systems in the CDE."
11,3.4(c),Segmentation Penetration Test - Qualified Vendors,"If segmentation is used to isolate the CDE from other networks, tests shall be performed by a qualified internal resource or qualified external third party, and if applicable, does organizational independence of the tester exist (not required to be a QSA or ASV)."
11,5(a),Change Detection,"A change-detection mechanism (for example, file-integrity monitoring tools) shall be deployed to detect unauthorized modification (including changes, additions, and deletions) of critical system files, configuration files, or content files. 
 
 Examples of files that should be monitored include: 
 - System executables 
 - Application executables 
 - Configuration and parameter files 
 - Centrally stored, historical or archived, log, and audit files 
 - Additional critical files determined by entity (for example, through risk assessment or other means)"
11,5(b),Change Detection - Configured to Alert,"The change-detection mechanism shall be configured to alert personnel to unauthorized modification (including changes, additions, and deletions) of critical system files, configuration files or content files, and  do the tools perform critical file comparisons at least weekly.
 Note: For change detection purposes, critical files are usually those that do not regularly change, but the modification of which could indicate a system compromise or risk of compromise. Change detection mechanisms such as file-integrity monitoring products usually come pre-configured with critical files for the related operating system. Other critical files, such as those for custom applications, must be evaluated and defined by the entity (that is the merchant or service provider)"
11,5.1,Change Detection Response,A process shall be in place to respond to any alerts generated by the change-detection solution.
12,1,Security Policies,"A security policy shall be established, published, maintained, and disseminated to all relevant personnel."
12,1.1,Security Policies Reviewed,The security policy shall be reviewed at least annually and updated when the environment changes.
12,3.1,Explicit Approval by Authorized Parties,"Usage policies for critical technologies shall be developed to define proper use of these technologies and require the following: 
Explicit approval by authorized parties to use the technologies.
 Note: Examples of critical technologies include, but are not limited to, remote access and wireless technologies, laptops, tablets, removable electronic media, e-mail usage and Internet usage."
12,3.2,Authentication for Use of Technology,"Usage policies for critical technologies shall be developed to define proper use of these technologies and require the following: Authentication for use of the technology.
 
 Note: Examples of critical technologies include, but are not limited to, remote access and wireless technologies, laptops, tablets, removable electronic media, e-mail usage and Internet usage."
12,3.3,List of All Devices,"Usage policies for critical technologies shall be developed to define proper use of these technologies and require the following: 
A list of all such devices and personnel with access.
 
 Note: Examples of critical technologies include, but are not limited to, remote access and wireless technologies, laptops, tablets, removable electronic media, e-mail usage and Internet usage."
12,3.5,Acceptable Uses,"Usage policies for critical technologies shall be developed to define proper use of these technologies and require the following: Acceptable uses of the technologies.
 
 Note: Examples of critical technologies include, but are not limited to, remote access and wireless technologies, laptops, tablets, removable electronic media, e-mail usage and Internet usage."
12,3.6,Network Locations,"Usage policies for critical technologies shall be developed to define proper use of these technologies and require the following: Acceptable network locations for the technologies. 
 
 Note: Examples of critical technologies include, but are not limited to, remote access and wireless technologies, laptops, tablets, removable electronic media, e-mail usage and Internet usage."
12,3.8,Automatic Disconnect of Sessions,"Usage policies for critical technologies shall be developed to define proper use of these technologies and require the following: Automatic disconnect of sessions for remote-access technologies after a specific period of inactivity. 
 Note: Examples of critical technologies include, but are not limited to, remote access and wireless technologies, laptops, tablets, removable electronic media, e-mail usage and Internet usage."
12,3.9,Remote-Access Technologies,"Usage policies for critical technologies shall be developed to define proper use of these technologies and require the following: Activation of remote-access technologies for vendors and business partners only when needed by vendors and business partners, with immediate deactivation after use. 
 
 Note: Examples of critical technologies include, but are not limited to, remote access and wireless technologies, laptops, tablets, removable electronic media, e-mail usage and Internet usage."
12,4,Security Responsibilities,Security policy and procedures shall clearly define information security responsibilities for all personnel. 
12,5.3,Incident Response and Escalation Procedures,"The following information security management responsibilities shall be formally assigned to an individual or team: 
Establishing, documenting, and distributing security incident response and escalation procedures to ensure timely and effective handling of all situations. "
12,6(a),Security Awareness Program,A formal security awareness program shall be in place to make all personnel aware of the cardholder data security policy and procedures.
12,8.1,List of Service Providers,"Policies and procedures shall be maintained and implemented to manage service providers with whom cardholder data is shared, or that could affect the security of cardholder data, as follows: 
A list of service providers shall be maintained, including a description of the service(s) provided."
12,8.2,Written Agreements Maintained,"Policies and procedures shall be maintained and implemented to manage service providers with whom cardholder data is shared, or that could affect the security of cardholder data, as follows: Is a written agreement maintained that includes an acknowledgement that the service providers are responsible for the security of cardholder data the service providers possess or otherwise store, process, or transmit on behalf of the customer, or to the extent that they could impact the security of the customers cardholder data environment.
 
 Note: The exact wording of an acknowledgement will depend on the agreement between the two parties, the details of the service being provided, and the responsibilities assigned to each party. The acknowledgement does not have to include the exact wording provided in this requirement."
12,8.3,Established Process for Engaging Service Providers,"The policies and procedures shall be maintained and implemented to manage service providers with whom cardholder data is shared, or that could affect the security of cardholder data, as follows: 
There shall be an established process for engaging service providers, including proper due diligence prior to engagement."
12,8.4,Monitor Service Providers,"The policies and procedures shall be maintained and implemented to manage service providers with whom cardholder data is shared, or that could affect the security of cardholder data, as follows: 
A program shall be maintained to monitor service providers PCI DSS compliance status at least annually. "
12,8.5,PCI DSS Requirements Managed by Service Providers,"Policies and procedures shall be maintained and implemented to manage service providers with whom cardholder data is shared, or that could affect the security of cardholder data, as follows: 
The information shall be maintained about which PCI DSS requirements are managed by each service provider, and which are managed by the entity. "
12,10.1(a),Incident Response Plan,An incident response plan shall be created to be implemented in the event of system breach.
12,10.1(b),Incident Response Plan Checklist,"The incident response plan shall address the following, at a minimum: 
 
 - Roles, responsibilities, and communication and contact strategies in the event of a compromise including notification of the payment brands, at a minimum
 - Specific incident response procedures
 - Business recovery and continuity procedures
 - Data backup processes
 - Analysis of legal requirements for reporting compromises
 - Coverage and responses of all critical system componenets 
 - Reference or inclusion of incident response procedures from the payment brands"
A2,1,POS POI Terminals,"For POS POI terminals (at the merchant or paymentacceptance location) using SSL and/or early TLS: 
The devices shall be confirmed to not be susceptible to any known exploits for SSL/early TLS.  
 
 Note: This requirement is intended to apply to the entity with the POS POI terminal, such as a merchant. This requirement is not intended for service providers who serve as the termination or connection point to those POS POI terminals. Requirements A2.2 and A2.3 apply to POS POI service providers."
