primary_id,sub_id,Name,Description
1,2.1(a),Inbound and Outbound Traffic Restricted,"Firewall and router configurations shall restrict connections between untrusted networks and any system in the cardholder data environment as follows: 
Inbound and outbound traffic shall be restricted to that which is necessary for the cardholder data environment.
 
 Note: An untrusted network is any network that is external to the networks belonging to the entity under review, and/or which is out of the entitys ability to control or manage."
1,2.1(b),All Other Traffic Denied,"Firewall and router configurations shall restrict connections between untrusted networks and any system in the cardholder data environment as follows: 
All other inbound and outbound traffic shall be specifically denied (for example by using an explicit deny all or an implicit deny after allow statement). 
 
 Note: An untrusted network is any network that is external to the networks belonging to the entity under review, and/or which is out of the entitys ability to control or manage."
1,2.3,Firewalls Installed Between Wireless Networks and Cardholder Data Environment,"Perimeter firewalls shall be installed between all wireless networks and the cardholder data environment, and these firewalls configured to deny or, if traffic is necessary for business purposes, permit only authorized traffic between the wireless environment and the cardholder data environment. "
1,3.4,Outbound Traffic Explicitly Authorized,"Direct public access shall be prohibited between the Internet and any system component in the cardholder data environment, as follows: 
Outbound traffic from the cardholder data environment to the Internet shall be explicitly authorized."
1,3.5,Direct Public Access Prohibited,"Direct public access shall be prohibited between the Internet and any system component in the cardholder data environment, as follows: 
Only established connections shall be permitted into the network."
2,1(a),Vendor Supplied Defaults,"Vendor-supplied defaults shall always be changed before installing a system on the network.
 
This applies to all default passwords, including but not limited to those used by operating systems, software that rovides security services, application and system accounts, point-of-sale (POS) terminals, payment applications, Simple Network Management Protocol (SNMP) community strings, etc.)."
2,1(b),Default Accounts,Unnecessary default accounts shall be removed or disabled before installing a system on the network.
2,1.1(a),Encryption Keys Changed from Default,"For wireless environments connected to the cardholder data environment or transmitting cardholder data, all wireless vendor defaults shall be changed at installations, as follows: 
Encryption keys shall be changed from default at installation, and changed anytime anyone with knowledge of the keys leaves the company or changes positions. "
2,1.1(b),Default SNMP Community Strings Changed,"For wireless environments connected to the cardholder data environment or transmitting cardholder data, all wireless vendor defaults shall be changed at installations, as follows: 
Default SNMP community strings on wireless devices shall be changed at installation."
2,1.1(c),Default Passwords on Access Points Changed,"For wireless environments connected to the cardholder data environment or transmitting cardholder data, all wireless vendor defaults shall be changed at installations, as follows:
Default passwords/passphrases on access points shall be changed at installation."
2,1.1(d),Firmware on Wireless Devices Updated,"For wireless environments connected to the cardholder data environment or transmitting cardholder data, all wireless vendor defaults shall be changed at installations, as follows: 
Firmware on wireless devices shall be updated to support strong encryption for authentication and transmission over wireless networks. "
2,1.1(e),Other Security-Related Wireless Vendor Defaults Changed,"For wireless environments connected to the cardholder data environment or transmitting cardholder data, all wireless vendor defaults shall be changed at installations, as follows: 
Other security-related wireless vendor defaults shall be changed, if applicable."
2,2(a),Configuration Standards,"Configuration standards shall be developed for all system components and shall be consistent with industry accepted system hardening standards. 
 
Sources of industry-accepted system hardening standards may include, but are not limited to, SysAdmin Audit Network Security (SANS) Institute, National Institute of Standards Technology (NIST), International Organization for Standardization (ISO), and Center for Internet Security (CIS)."
2,2(b),Standards Updated,"System configuration standards shall be updated as new vulnerability issues are identified, as defined in Requirement 6.1"
2,2(c),Standards Applied to New Systems,System configuration standards shall be applied when new systems are configured. 
2,2(d),Configuration Standards Checklist,"System configuration standards shall include all of the following: 
 
 - Changing of all vendor-supplied defaults and elimination of unnecessary default accounts
 - Implementing only one primary function per server to prevent functions that require different security levels from co-existing on the same server
 - Enabling only necessary services, protocols, daemons, etc., as required for the function of the system
 - Implementing additional security features for any required services, protocols or daemons that are considered to be insecure
 - Configuring system security parameters to prevent misuse
 - Removing all unnecessary functionality, such as scripts, drivers, features, subsystems, file systems, and unnecessary web servers"
2,2.1(a),Primary Function Per Server,"Only one primary function shall be implemented per server, to prevent functions that require different security levels from co-existing on the same server. 
For example, web servers, database servers, and DNS should be implemented on separate servers."
2,2.1(b),Virtualization Technologies,"If virtualization technologies are used, only one primary function shall be implemented per virtual system component or device."
2,2.2(a),Enable Only Necessary Services,"Only necessary services, protocols, daemons, etc. shall be enabled as required for the function of the system (services and protocols not directly needed to perform the devices specified function are disabled). "
2,2.2(b),Enable Only Necessary Services - Documentation,"All enabled insecure services, daemons, or protocols shall be justified per documented configuration standards."
2,2.3,Security Features for Required Services,"Additional security features shall be documented and implemented for any required services, protocols or daemons that are considered to be insecure. "
2,2.4(a),Configure System Security,System administrators and/or personnel that configure system components shall be knowledgeable about common security parameter settings for those system components. 
2,2.4(b),Configure System Security - Common Settings,Common system security parameters settings shall be included in the system configuration standards.
2,2.4(c),Configure System Security - Set Appropriately,Security parameter settings shall be set appropriately on system components. 
2,2.5(a),Remove Unnecessary Functionality,"All unnecessary functionality such as scripts, drivers, features, subsystems, file systems, and unnecessary web servers shall be removed."
2,2.5(b),Enabled Functions Documented,Enabled functions shall be documented and support secure configuration.
2,2.5(c),Documented Functions on Components,Only documented functionality shall be present on system components. 
2,3(a),Encrypted administrative access,"Non-console administrative access shall be encrypted as follows: 
All non-console administrative access shall be encrypted with strong cryptography, and is a strong encryption method invoked before the administrators password is requested."
2,3(b),Prevent Telnet,"Non-console administrative access shall be encrypted as follows: 
System services and parameter files shall be configured to prevent the use of Telnet and other insecure remote login commands."
2,3(c),Interface Encryption,"Non-console administrative access shall be encrypted as follows: 
Administrator access to web-based management interfaces shall be encrypted with strong cryptography."
2,3(d),Industry Best Practices,"Non-console administrative access shall be encrypted as follows: 
For the technology in use, strong cryptography shall be implemented according to industry best practice and/or vendor recommendations."
2,5,Security Policies and Procedures,"Security policies and operational procedures for managing vendor defaults and other security parameters shall be: 
 
 - Documented 
 - In use 
 - Known to all affected parties"
3,2(c),Authentication Data Deleted,Sensitive authentication data shall be deleted or rendered unrecoverable upon completion of the authorization process. 
3,2.1,Full Contents Not Stored,"All systems shall adhere to the following requirements regarding non-storage of sensitive authentication data after authorization (even if encrypted): 
The full contents of any track (from the magnetic stripe located on the back of a card, equivalent data contained on a chip, or elsewhere) shall not be stored after authorization. 
 
 This data is alternatively called full track, track, track 1, track 2, and magnetic-stripe data. 
 
 Note: In the normal course of business, the following data elements from the magnetic stripe may need to be retained: 
 
  The cardholders name, 
  Primary account number (PAN), 
  Expiration date, and 
  Service code 
 
 To minimize risk, store only these data elements as needed for business."
3,2.2,Code or Value Not Stored,"All systems shall adhere to the following requirements regarding non-storage of sensitive authentication data after authorization (even if encrypted): 
The card verification code or value (three-digit or fourdigit number printed on the front or back of a payment card) shall not be stored after authorization."
3,2.3,PIN Not Stored,"All systems shall adhere to the following requirements regarding non-storage of sensitive authentication data after authorization (even if encrypted): 
The personal identification number (PIN) or the encrypted PIN block shall not be stored after authorization."
3,3,PAN Masked When Displayed,"The PAN shall be masked when displayed (the first six and last four digits are the maximum number of digits to be displayed) such that only personnel with a legitimate business need can see more than the first six/last four digits of the PAN. 
 
 Note: This requirement does not supersede stricter requirements in place for displays of cardholder datafor example, legal or payment card brand requirements for point-of-sale (POS) receipts."
4,1(a),Use Strong Cryptography to Protect Cardholder Data,"Strong cryptography and security protocols shall be used to safeguard sensitive cardholder data during transmission over open, public networks. 
 
 Note: Examples of open, public networks include but are not limited to the Internet; wireless technologies, including 802.11 and Bluetooth; cellular technologies, for example, Global System for Mobile communications (GSM), Code division multiple access (CDMA); and General Packet Radio Service (GPRS)."
4,1(b),Trusted Keys,Only trusted keys and/or certificates shall be accepted.
4,1(c),Security Protocols,"Security protocols shall be implemented to use only secure configurations, and to not support insecure versions or configurations."
4,1(d),Encryption Strength,The proper encryption strength shall be implemented for the encryption methodology in use (check vendor recommendations/best practices).
4,1(e),TLS Enabled,"For TLS implementations, TLS shall be enabled whenever cardholder data is transmitted or received: 
 
 For example, for browser-based implementations: 
 - HTTPS appears as the browser Universal Record Locator (URL) protocol, and 
 - Cardholder data is only requested if HTTPS appears as part of the URL."
4,1.1,Best Practices to Implement Strong Encryption,Industry best practices shall be used to implement strong encryption for authentication and transmission for wireless networks transmitting cardholder data or connected to the cardholder data environment.
4,2(b),Never Send Unprotected PANs,Policies shall be in place that state that unprotected PANs are not to be sent via end-user messaging technologies.
5,1,Deploy Anti-virus software,Anti-virus software shall be deployed on all systems commonly affected by malicious software.
5,1.1,Ensure Anti-virus is Capable and Adequate,"Anti-virus programs shall be capable of detecting, removing, and protecting against all known types of malicious software (for example, viruses, Trojans, worms, spyware, adware, and rootkits)."
5,1.2,Evaluate Low Risk Systems,Periodic evaluations shall be performed to identify and evaluate evolving malware threats in order to confirm whether those systems considered to not be commonly affected by malicious software continue as such.
5,2(a),Maintain Anti-virus,"Anti-virus mechanisms shall be maintained as follows: 
Anti-virus software and definitions shall be kept current."
5,2(b),Automatic Updates,"All anti-virus mechanisms shall be maintained as follows: 
Automatic updates and periodic scans shall be enabled and being performed. "
5,2(c),Audit Logs,"All anti-virus mechanisms shall be maintained as follows:
All anti-virus mechanisms generating audit logs, and are logs shall be retained in accordance with PCI DSS Requirement 10.7"
5,3,Anti-virus Assurance,"All anti-virus mechanisms shall be: 
 - Actively running
 - Unable to be disabled or altered by users
 
 Note: Anti-virus solutions may be temporarily disabled only if there is legitimate technical need, as authorized by management on a case-by-case basis. If anti-virus protection needs to be disabled for a specific purpose, it must be formally authorized. Additional security  measures may also need to be implemented for the period of time during which anti-virus protection is not active."
6,1,Identify Security Vulnerabilities,"There shall be a process to identify security vulnerabilities, including the following: 
 
 - Using reputable outside sources for vulnerability information
 - Assigning a risk ranking to vulnerabilities that includes identification of all high risk and critical vulnerabilities
 
Note: Risk rankings should be based on industry best practices as well as consideration of potential impact. For example, criteria for ranking vulnerabilities may include consideration of the CVSS base score and/or the classification by the vendor, and/or type of systems affected. 
 
 Methods for evaluating vulnerabilities and assigning risk ratings will vary based on an organizations environment and risk assessment strategy. Risk rankings should, at a minimum, identify all vulnerabilities considered to  be a high risk to the environment. In addition to the risk ranking, vulnerabilities may be considered critical if they pose an imminent threat to the environment, impact critical systems, and/or would result in a potential compromise if not addressed. Examples of critical systems may include security systems, public-facing devices and systems, databases, and other systems that store, process or transmit cardholder data."
6,2(a),System and Software Protection,All system components and software shall be protected from known vulnerabilities by installing applicable vendor-supplied security patches. 
6,2(b),Critical Security Patches,"Critical security patches shall be installed within one month of release.
 
 Note: Critical security patches should be identified according to the risk ranking process defined in Requirement 6.1."
6,4.6,PCI DSS Requirements Implemented,"Upon completion of a significant change, all relevant PCI DSS requirements shall be implemented on all new or changed systems and networks, and documentation updated as applicable."
7,1.2,Access Limited to Least Privileges,"Access to system components and cardholder data shall be limited to only those individuals whose jobs require such access, as follows: Is access to privileged user IDs restricted as follows: 
 
 - To least privileges necessary to perform job responsibilities
 - Assigned only to roles that specifically require that privileged access"
7,1.3,Access Assigned Based on Job Classification,"Access to system components and cardholder data shall be limited to only those individuals whose jobs require such access, as follows: 
Access shall be assigned based on individual personnels job classification and function"
8,1.1,Unique IDs,All users shall be assigned a unique ID before allowing them to access system components or cardholder data.
8,1.5(a),Monitor Third Parties Remote Accounts,"Accounts used by third parties to access, support, or maintain system components via remote access shall be enabled only during the time period needed and disabled when not in use."
8,1.5(b),Monitor Third Parties Remote Accounts - In Use,Third-party remote access accounts shall be monitored when in use.
8,1.6(a),Limit Failed Access Attempts,Repeated access attempts shall be limited by locking out the user ID after no more than six attempts.
8,1.7,Account Lockout Duration,"Once a user account is locked out, the lockout duration shall be set to a minimum of 30 minutes or until an administrator enables the user ID. "
8,1.8,Timeouts and Reauthentication,"If a session has been idle for more than 15 minutes, users shall be required to re-authenticate (for example, re-enter the password) to re-activate the terminal or session."
8,2,Authentication Methods,"In addition to assigning a unique ID, one or more of the following methods shall be employed to authenticate all users:
 
 - Something you know, such as a password or passphrase 
 - Something you have, such as a token device or smart card 
 - Something you are, such as a biometric"
8,2.3(a),Password Requirements,"User password parameters shall be configured to require passwords/passphrases meet the following:
 A minimum password length of at least seven characters 
 Contain both numeric and alphabetic characters 
 Alternatively, the passwords/passphrases must have complexity and strength at least equivalent to the parameters specified above."
8,2.4,Change User Passwords Every 90 Days,User passwords/passphrases shall be changed at least every 90 days.
8,2.5,Password reuse requirements,An individual shall submit a new password/phrase that is different from any of the last four passwords/passphrases he or she has used.
8,2.6,First Time Passwords and Password Resets,"Passwords/passphrases shall be set to a unique value for each user for first-time use and upon reset, and must each user change their password immediately after the first use."
8,3.1,Multi-Factor Authentication for Administrative Access to CDE,"All individual non-console administrative access and all remote access to the CDE shall be secured using multi-factor authentication, as follows:  
Multi-factor authentication shall be incorporated for all nonconsole access into the CDE for personnel with administrative access. 
 
 Note: Multi-factor authentication requires that a minimum of two of the three authentication methods (see PCI DSS Requirement 8.2 for descriptions of authentication methods) be used for authentication. Using one factor twice (for example, using two separate passwords) is not considered multi-factor authentication."
8,3.2,Multi-Factor Authentication for Remote Access,"All individual non-console administrative access and all remote access to the CDE shall be secured using multi-factor authentication, as follows: 
Multi-factor authentication shall be incorporated for all remote network access (both user and administrator, and including third-party access for support or maintenance) originating from outside the entitys network. 
 
 Note: Multi-factor authentication requires that a minimum of two of the three authentication methods (see PCI DSS Requirement 8.2 for descriptions of authentication methods) be used for authentication. Using one factor twice (for example, using two separate passwords) is not considered multi-factor authentication."
8,4(a),Communicate Policies and Procedures to End Users,Authentication policies and procedures shall be documented and communicated to all users.
8,4(b),Communicate Policies and Procedures to End Users - Checklist,"Authentication policies and procedures shall include the following:
 
 - Guidance on selecting strong authentication credentials 
 - Guidance for how users should protect their authentication credentials 
 - Instructions not to reuse previously used passwords 
 - Instructions that users should change passwords if there is any suspicion the password could be compromised"
8,5,Shared Accounts,"Group, shared, or generic accounts, passwords, or other authentication methods shall be prohibited as follows: 
 
 Generic user IDs and accounts are disabled or removed; 
 Shared user IDs for system administration activities and other critical functions do not exist; and 
 Shared and generic user IDs are not used to administer any system components."
8,8,Identification and Authentication Policies and Procedures,"Security policies and operational procedures for identification and authentication shall be: 
 
 - Documented 
 - In use 
 - Known to all affected parties"
9,1,Facility Entry Controls,Appropriate facility entry controls shall be in place to limit and monitor physical access to systems in the cardholder data environment.
9,1.1(a),Monitor Physical Access,"Either video cameras or access control mechanisms (or both) shall be in place to monitor individual physical access to sensitive areas.
 
 Note: Sensitive areas refers to any data center, server room, or any area that houses systems that store, process, or transmit cardholder data. This excludes public-facing areas where only point-of-sale terminals are present such as the cashier areas in a retail store."
9,1.1(b),Protected from Tampering or Disabling,Either video cameras or access control mechanisms (or both) shall be protected from tampering or disabling.
9,1.1(c),Reviewed and Correlated,Data collected from video cameras and/or access control mechanisms shall be reviewed and correlated with other entries.
9,1.1(d),Storage,Data collected from video cameras and/or access control mechanisms shall be stored for at least three months unless otherwise restricted by law.
9,1.2,Restrict Access to Publicly Accessible Network Jacks,"Physical and/or logical controls shall be in place to restrict access to publicly accessible network jacks. 
 
 For example, network jacks located in public areas and areas accessible to visitors could be disabled and only enabled when network access is explicitly authorized. Alternatively, processes could be implemented to ensure that visitors are escorted at all times in areas with active network jacks."
9,5,Physically Secure All Media,"All media shall be physically secured (including but not limited to computers, removable electronic media, paper receipts, paper reports, and faxes). 
 
 For purposes of Requirement 9, media refers to all paper and electronic media containing cardholder data."
9,6(a),Media Distribution Control - Maintained,Strict control shall be maintained over the internal or external distribution of any kind of media.
9,6.1,Classify Media Sensitivity,"Controls shall include the following: 
Media shall be classified so the sensitivity of the data can be determined. "
9,6.2,Send Media Securely,"Controls shall include the following: 
Media sent by secured courier or other delivery method that can be accurately tracked."
9,6.3,Management Approval of Media Distribution,"Controls shall include the following: 
Management approval shall be obtained prior to moving the media (especially when media is distributed to individuals)."
9,7,Media Access and Storage Controls,Strict control shall be maintained over the storage and accessibility of media.
9,8(a),Media Destruction,All media shall be destroyed when it is no longer needed for business or legal reasons.
9,8.1(a),Media Destruction - Hardcopy Materials,"Media destruction shall be performed as follows: 
Hardcopy materials shall be cross-cut shredded, incinerated, or pulped so that cardholder data cannot be reconstructed."
9,8.1(b),Media Destruction - Storage Containers,"Media destruction shall be performed as follows: 
Storage containers shall be used for materials that contain information to be destroyed secured to prevent access to the contents."
9,9(a),List of Devices,"Devices that capture payment card data via direct physical interaction with the card protected against tampering and substitution as follows: 
Policies and procedures shall require that a list of such devices be maintained.
 
 Note: This requirement applies to card-reading devices used in card-present transactions (that is, card swipe or dip) at the point of sale. This requirement is not intended to apply to manual key-entry components such as computer keyboards and POS keypads."
9,9(b),Periodically Inspected,"Devices that capture payment card data via direct physical interaction with the card protected against tampering and substitution as follows:  
Policies and procedures shall require that devices are periodically inspected to look for tampering or substitution.
 
 Note: This requirement applies to card-reading devices used in card-present transactions (that is, card swipe or dip) at the point of sale. This requirement is not intended to apply to manual key-entry components such as computer keyboards and POS keypads."
